{
  "$schema": "http://json-schema.org/draft-03/schema",
  "title": "Get Product ProductId Variations Schema",
  "type": "object",
  "properties": {
    "variationAttributes": {
      "type": "array of [variationAttribute](page:apps-data-types#variationattribute)",
      "description": "The existing variations of the product, e.g. colour."
    },
    "items": {
      "type": "array of [variation](page:apps-data-types#variation)",
      "description": "The available variations of the product that are set visible in the administration area of the shop."
    },
    "results": {
      "type": "integer",
      "description": "The number of variations in total."
    },
    "resultsPerPage": {
      "type": "integer",
      "description": "The number of variations returned per page."
    },
    "page": {
      "type": "integer",
      "description": "The page number on which the variation appears."
    },
    "links": {
      "type": "array of [link](page:apps-data-types#link)",
      "description": "The links to the product variations."
    }
  }
}
